{
  "video_id": "dQw4w9WgXcQ",
  "url": "https://www.youtube.com/watch?v=dQw4w9WgXcQ",
  "title": "Getting Started with Claude Code and Cursor — MCP Integration Tutorial",
  "channel": "Anthropic Developers",
  "duration": 96.2,
  "created_at": "2026-05-25T00:00:00+09:00",
  "status": "subtitle_fetched"
}
